number,value,datetime_start,datetime_complete,duration,params_C,params_cleaning_neighbors,params_feature_mode,params_gamma,params_geometry_clusters,params_geometry_neighbors,params_imputer,params_local_geometry,params_sampling_strategy_name,params_scaler,params_smote_neighbors,params_smote_ratio,params_winsor_mode,user_attrs_mean_average_precision,user_attrs_mean_roc_auc,user_attrs_std_average_precision,state
0,0.5367557354140193,2026-07-21 21:36:26.885316,2026-07-21 21:36:34.218563,0 days 00:00:07.333247,0.0629064429458615,7.0,basic,0.034890188454913866,,,median,none,allknn,power,,,p01,0.5059869953331919,0.6221704701932,0.040863023771750315,COMPLETE
1,0.4930513552225367,2026-07-21 21:36:34.223169,2026-07-21 21:36:49.592834,0 days 00:00:15.369665,48.696409415209004,5.0,ratios,0.0018427970406864537,,7.0,median_indicator,density_anomaly,ncr,robust,,,none,0.46513691723493783,0.5691556477726232,0.03291181173706717,COMPLETE
2,0.552157274881568,2026-07-21 21:36:49.600248,2026-07-21 21:37:00.446202,0 days 00:00:10.845954,0.17535949529764422,,full,0.009452571391072306,,,median_indicator,none,smote_tomek,robust,3.0,0.7658143086984273,p025,0.5285208993829994,0.6170863994013003,0.02933274506921675,COMPLETE
3,0.5874392907076955,2026-07-21 21:37:00.451363,2026-07-21 21:37:10.926973,0 days 00:00:10.475610,52.334804885400885,,ratios,0.26568139241144917,,7.0,median_indicator,density_anomaly,class_weight_balanced,robust,,,p025,0.560615272318337,0.659687932421229,0.028977796415090684,COMPLETE
4,0.5474741892945469,2026-07-21 21:37:10.932627,2026-07-21 21:37:17.233567,0 days 00:00:06.300940,0.9749762207436125,,basic,0.007991621920384355,,9.0,median,density,smote_enn,power,5.0,0.9868565532297389,p01,0.5165311863038738,0.6298191092516218,0.030433738936513317,COMPLETE
5,0.5227963860653199,2026-07-21 21:37:17.237624,2026-07-21 21:37:19.249719,0 days 00:00:02.012095,0.011650681118986135,7.0,ratios,0.03437788661779579,,9.0,median_indicator,density,allknn,robust,,,none,0.49456818945433056,0.5938369068286387,0.015524186013031033,COMPLETE
6,0.5674968435642713,2026-07-21 21:37:19.252707,2026-07-21 21:37:24.692805,0 days 00:00:05.440098,13.16746532693615,,full,0.0843519134174305,,7.0,median_indicator,density,tomek,standard,,,p01,0.5387300487347353,0.6431605855030291,0.025623662009520737,COMPLETE
7,0.5393945556196174,2026-07-21 21:37:24.697218,2026-07-21 21:37:27.934509,0 days 00:00:03.237291,3.346220103048383,,ratios,0.24234491447023154,,13.0,median_indicator,density,smote_enn,robust,9.0,0.7875842036333661,none,0.5072148046892504,0.6192752730297333,0.014383895717779387,COMPLETE
8,0.554099369327812,2026-07-21 21:37:27.939094,2026-07-21 21:37:35.297237,0 days 00:00:07.358143,2.8842234716878457,,basic,0.9336015204266915,7.0,15.0,median,density_clusters,smote_tomek,robust,3.0,0.8495214095312777,p01,0.5230918961846618,0.6336127415140497,0.021487804556661865,COMPLETE
9,0.5564071392164102,2026-07-21 21:37:35.300303,2026-07-21 21:37:40.766339,0 days 00:00:05.466036,2.308516815110802,,ratios,0.001234527446602447,6.0,13.0,median_indicator,density_clusters,none,power,,,p025,0.5315017193721839,0.6226107634328868,0.02427293373984634,COMPLETE
10,0.5882165445288976,2026-07-21 21:37:40.770603,2026-07-21 21:37:52.212436,0 days 00:00:11.441833,57.5179249610795,,ratios,0.23491883444594824,,5.0,median_indicator,density_anomaly,class_weight_balanced,robust,,,p025,0.5616031356068301,0.6599483894956216,0.02890167244569932,COMPLETE
11,0.5525131616212773,2026-07-21 21:37:52.216954,2026-07-21 21:38:01.780456,0 days 00:00:09.563502,20.38268813126058,,ratios,0.9689063035201977,,5.0,median_indicator,density_anomaly,class_weight_balanced,robust,,,p025,0.5213415042349233,0.6335869868007987,0.025019873834086617,COMPLETE
12,0.5616490790225108,2026-07-21 21:38:01.783535,2026-07-21 21:38:06.479616,0 days 00:00:04.696081,96.3936470839991,3.0,basic,0.03734361232054627,,5.0,median_indicator,density_anomaly,enn,robust,,,p01,0.5342390881287876,0.6318880533351998,0.01884698668200433,COMPLETE
13,0.6013731389462093,2026-07-21 21:38:06.485057,2026-07-21 21:38:16.733462,0 days 00:00:10.248405,73.71051384239004,,none,0.08226056914958636,,5.0,median,density_anomaly,class_weight_balanced,robust,,,p025,0.5790147200311708,0.6596268960241984,0.018252338828698672,COMPLETE
14,0.6086033358480978,2026-07-21 21:38:16.737132,2026-07-21 21:38:24.053529,0 days 00:00:07.316397,16.83770548229096,,none,0.17550779384730275,,5.0,median,density_anomaly,tomek,robust,,,p025,0.58696301699424,0.6661185863451963,0.021063519514289992,COMPLETE
15,0.5706277445663276,2026-07-21 21:38:24.056681,2026-07-21 21:38:31.628218,0 days 00:00:07.571537,3.8629440037023737,,none,0.03861130220967559,,5.0,median,density_anomaly,smote_enn,robust,7.0,0.680182670098057,p025,0.543021772469848,0.6406998036020548,0.016974372431824033,COMPLETE
16,0.5293457984632615,2026-07-21 21:38:31.632468,2026-07-21 21:38:39.511980,0 days 00:00:07.879512,4.64074321641648,,none,0.42539432820592743,,5.0,median,density_anomaly,tomek,power,,,p025,0.4956055682371831,0.6167542194333004,0.026043651327568383,COMPLETE
17,0.5751960110342191,2026-07-21 21:38:39.516388,2026-07-21 21:38:45.315770,0 days 00:00:05.799382,93.5086992051217,3.0,none,0.13786820328527238,3.0,9.0,median,density_clusters,enn,robust,,,p025,0.5489075264500289,0.6458040121990573,0.0278046114051824,COMPLETE
18,0.5630113621956351,2026-07-21 21:38:45.321895,2026-07-21 21:38:52.702325,0 days 00:00:07.380430,87.24354947606433,,none,0.009667692149943315,,5.0,median,density_anomaly,class_weight_balanced,robust,,,p025,0.5427482686294796,0.6178730936689034,0.022743539456715332,COMPLETE
19,0.5705361872039577,2026-07-21 21:38:52.706391,2026-07-21 21:39:02.875353,0 days 00:00:10.168962,4.315622116633113,,basic,0.12465673445197488,,11.0,median,density_anomaly,class_weight_balanced,standard,,,p025,0.5413765816279879,0.6452443778447039,0.020007332890448936,COMPLETE
20,0.5152731034156082,2026-07-21 21:39:02.878468,2026-07-21 21:39:10.887599,0 days 00:00:08.009131,83.0820535992904,,none,0.7355321975945649,,7.0,median,density_anomaly,smote,standard,9.0,0.9148142911748622,p025,0.4774231960784096,0.6117100487525654,0.024361484650481238,COMPLETE
21,0.602846627103314,2026-07-21 21:39:10.890501,2026-07-21 21:39:21.146211,0 days 00:00:10.255710,53.58417948021452,,none,0.23483029165975317,,5.0,median,density_anomaly,class_weight_balanced,robust,,,p01,0.5773087514687836,0.6701947874923729,0.023279351725464224,COMPLETE
22,0.6054749103241668,2026-07-21 21:39:21.149393,2026-07-21 21:39:29.075850,0 days 00:00:07.926457,17.976717153142385,,none,0.2887230632578284,,5.0,median,density_anomaly,class_weight_balanced,robust,,,p01,0.579979204789262,0.6723427634658689,0.022133620680772403,COMPLETE
23,0.585014248184627,2026-07-21 21:39:29.080506,2026-07-21 21:39:40.482510,0 days 00:00:11.402004,58.845750076788065,,none,0.47777608199665855,,5.0,median,density_anomaly,none,robust,,,p01,0.5576208063547806,0.657090802906433,0.024475571356492313,COMPLETE
24,0.5173516477021006,2026-07-21 21:39:40.485486,2026-07-21 21:39:44.811415,0 days 00:00:04.325929,1.9521271336010253,,none,0.6737498044546503,,,median,none,class_weight_balanced,standard,,,p01,0.4790035722912099,0.614878039644828,0.02414264795194701,COMPLETE
25,0.603679847264149,2026-07-21 21:39:44.816044,2026-07-21 21:39:48.655680,0 days 00:00:03.839636,16.79393378657612,,none,0.044972266690672044,,,median,none,smote,robust,5.0,0.6524565471678444,p01,0.582571347065481,0.6597352776266099,0.02040678969670631,COMPLETE
26,0.541238735139122,2026-07-21 21:39:48.660517,2026-07-21 21:39:52.774344,0 days 00:00:04.113827,2.423573074370581,5.0,full,0.21471288226279747,,9.0,median,density_anomaly,enn,robust,,,p01,0.5095712178574304,0.6229503391859649,0.02346219116868719,COMPLETE
27,0.5991982446687981,2026-07-21 21:39:52.777472,2026-07-21 21:39:55.930440,0 days 00:00:03.152968,68.642785071548,,none,0.013707974404791216,,,median,none,smote,robust,5.0,0.6560754412270191,p01,0.5786170904859658,0.6540845395449447,0.020590805348612358,COMPLETE
28,0.5691860487066226,2026-07-21 21:39:55.933832,2026-07-21 21:39:58.847380,0 days 00:00:02.913548,7.116019356383984,5.0,none,0.09658099536420821,,,median,none,ncr,robust,,,none,0.5447390555352482,0.6332902562379221,0.021183670394276734,COMPLETE
29,0.5677275686605711,2026-07-21 21:39:58.851796,2026-07-21 21:40:04.678577,0 days 00:00:05.826781,0.24692492407736616,,ratios,0.10162232682251854,,,median,none,smote,robust,7.0,0.7342548697616492,p01,0.5455396031055344,0.6273959720079637,0.02368945115692133,COMPLETE
30,0.5818643529155788,2026-07-21 21:40:04.683079,2026-07-21 21:40:11.089467,0 days 00:00:06.406388,2.1710854278666574,,full,0.7494054150421567,,7.0,median,density_anomaly,tomek,robust,,,p025,0.5557680092808205,0.6524699694466058,0.029142444149771823,COMPLETE
31,0.5927035784009369,2026-07-21 21:40:11.093181,2026-07-21 21:40:19.667889,0 days 00:00:08.574708,3.431480746491789,,none,0.13336605902514756,,5.0,median,density_anomaly,class_weight_balanced,robust,,,p01,0.5704373281103399,0.6496744854327923,0.015048969061386266,COMPLETE
32,0.5781793728322842,2026-07-21 21:40:19.671083,2026-07-21 21:40:33.252605,0 days 00:00:13.581522,45.954143635358555,,none,0.08161524832012239,,5.0,median_indicator,density_anomaly,class_weight_balanced,power,,,p01,0.5519585540079179,0.6502333051908163,0.0326160653050323,COMPLETE
33,0.5414879200344048,2026-07-21 21:40:33.257032,2026-07-21 21:40:43.446912,0 days 00:00:10.189880,33.34952016809952,,ratios,0.9624929532860572,,5.0,median,density_anomaly,class_weight_balanced,robust,,,p01,0.5101328183767289,0.6224086378974902,0.02327644198552373,COMPLETE
34,0.5925907213650025,2026-07-21 21:40:43.450595,2026-07-21 21:40:52.257811,0 days 00:00:08.807216,64.78522274298484,,full,0.0879294056602394,,7.0,median,density,class_weight_balanced,robust,,,p01,0.5682432313775271,0.6597529547768913,0.031054270323339055,COMPLETE
35,0.5983518639285256,2026-07-21 21:40:52.261443,2026-07-21 21:40:58.581787,0 days 00:00:06.320344,48.47302051923868,,none,0.18749873694723068,4.0,5.0,median,density_clusters,class_weight_balanced,robust,,,p01,0.5724008695844696,0.6688604811644245,0.029868891299305016,COMPLETE
36,0.5259958075263818,2026-07-21 21:40:58.585034,2026-07-21 21:41:09.818618,0 days 00:00:11.233584,64.23346144477914,,none,0.27949707431333304,,7.0,median,density_anomaly,class_weight_balanced,standard,,,p01,0.49302547589838824,0.61229709875339,0.028111552285069258,COMPLETE
37,0.584469835196092,2026-07-21 21:41:09.823370,2026-07-21 21:41:18.599239,0 days 00:00:08.775869,43.10983656179288,,none,0.4413717715037215,,7.0,median,density,tomek,robust,,,p025,0.5578062419723242,0.6535301037323714,0.020535653042464054,COMPLETE
38,0.5477306754471578,2026-07-21 21:41:18.605084,2026-07-21 21:41:31.405623,0 days 00:00:12.800539,41.6262219209157,,basic,0.12055671249176969,,5.0,median,density_anomaly,tomek,power,,,p01,0.5199876979713152,0.6206906378414583,0.024679044852003364,COMPLETE
39,0.5954981271915272,2026-07-21 21:41:31.410672,2026-07-21 21:41:41.423396,0 days 00:00:10.012724,20.91578189927556,,none,0.3419279240661953,,7.0,median_indicator,density_anomaly,smote,robust,5.0,0.6511490394536134,none,0.5702840364066469,0.6630099508885671,0.026036835596957273,COMPLETE
40,0.5846577170895231,2026-07-21 21:41:41.427047,2026-07-21 21:41:45.358306,0 days 00:00:03.931259,6.139268843393458,,basic,0.046957143181219366,,,median,none,smote,robust,3.0,0.7420583354766652,p025,0.5649146716528008,0.6383482813809445,0.022870374817208907,COMPLETE
41,0.6057671792354864,2026-07-21 21:41:45.364857,2026-07-21 21:41:53.952593,0 days 00:00:08.587736,21.208576754110172,,none,0.08397329806343565,,5.0,median,density_anomaly,tomek,robust,,,p025,0.5851673187396078,0.6610483973054395,0.02164463073870827,COMPLETE
42,0.6081073915575681,2026-07-21 21:41:53.957170,2026-07-21 21:42:03.448639,0 days 00:00:09.491469,50.39020931541636,,none,0.18259914143476205,,5.0,median,density_anomaly,tomek,robust,,,none,0.5827276958961962,0.6734512188328768,0.01837361219632255,COMPLETE
43,0.6155136280696425,2026-07-21 21:42:03.451997,2026-07-21 21:42:10.703200,0 days 00:00:07.251203,3.4525347882453046,,none,0.39747664951607115,,5.0,median,density_anomaly,tomek,robust,,,none,0.5915336236982293,0.6774856640415934,0.01805607731596011,COMPLETE
44,0.5904343007911803,2026-07-21 21:42:10.707812,2026-07-21 21:42:21.933393,0 days 00:00:11.225581,41.33176339443272,,none,0.4649889451068825,,5.0,median,density_anomaly,tomek,robust,,,none,0.5650097738483966,0.6595280736013727,0.02930962983108989,COMPLETE
45,0.5777951419359909,2026-07-21 21:42:21.936806,2026-07-21 21:42:29.364020,0 days 00:00:07.427214,29.554385950681013,3.0,none,0.067451364972736,,5.0,median,density_anomaly,ncr,power,,,none,0.5498424548275855,0.6526165783974535,0.028795499625549854,COMPLETE
46,0.6157323996827627,2026-07-21 21:42:29.368791,2026-07-21 21:42:38.155178,0 days 00:00:08.786387,1.2519747115129674,,none,0.09539784477077082,,5.0,median,density_anomaly,tomek,standard,,,none,0.5934544996663295,0.6743159024710694,0.019805208249886436,COMPLETE
47,0.6041782996908117,2026-07-21 21:42:38.159701,2026-07-21 21:42:45.148971,0 days 00:00:06.989270,22.178686098548024,,none,0.06874172516563265,,5.0,median,density_anomaly,tomek,robust,,,p025,0.5836877761015953,0.6592398519685799,0.021750991708789986,COMPLETE
48,0.4646498938964732,2026-07-21 21:42:45.151996,2026-07-21 21:42:53.568607,0 days 00:00:08.416611,0.35137159794642575,7.0,none,0.9936638530743768,,5.0,median,density_anomaly,ncr,standard,,,none,0.4255438571943578,0.5614710898767145,0.016721331025915564,COMPLETE
49,0.5929307235817671,2026-07-21 21:42:53.571344,2026-07-21 21:42:57.573803,0 days 00:00:04.002459,9.72290422838983,,basic,0.30950423209419375,,,median,none,tomek,robust,,,none,0.568193992041881,0.6574624162470822,0.020437957216742856,COMPLETE
50,0.5969974534837225,2026-07-21 21:42:57.576825,2026-07-21 21:43:05.056522,0 days 00:00:07.479697,0.5557936735603382,,full,0.06576721299229189,,5.0,median,density_anomaly,tomek,standard,,,none,0.5750584827678301,0.6580837543701248,0.02968610764796014,COMPLETE
51,0.5928840906060978,2026-07-21 21:43:05.062063,2026-07-21 21:43:13.120664,0 days 00:00:08.058601,3.254438839994426,,none,0.017548540169032373,,5.0,median_indicator,density_anomaly,tomek,standard,,,p025,0.5706906312681388,0.6503539062066641,0.01705523143598481,COMPLETE
52,0.5633674205391378,2026-07-21 21:43:13.127532,2026-07-21 21:43:23.266836,0 days 00:00:10.139304,0.25195227169673806,,basic,0.13269530271809343,,5.0,median,density_anomaly,smote,robust,9.0,0.8787603984104535,none,0.5412479062095091,0.6222630079848477,0.021850162029728778,COMPLETE
53,0.6098266001350546,2026-07-21 21:43:23.271595,2026-07-21 21:43:30.186594,0 days 00:00:06.914999,6.836790275809681,,none,0.024684990115489056,,5.0,median,density_anomaly,tomek,standard,,,none,0.5872472861432565,0.6686851773404905,0.01852053367371988,COMPLETE
54,0.5976146213468861,2026-07-21 21:43:30.189428,2026-07-21 21:43:40.431487,0 days 00:00:10.242059,29.31934828040649,,none,0.01898774014324631,,7.0,median,density_anomaly,smote,standard,7.0,0.9724227628926685,none,0.572947804377392,0.6616536634604717,0.01944940755429701,COMPLETE
55,0.6126698591262171,2026-07-21 21:43:40.434637,2026-07-21 21:43:47.569657,0 days 00:00:07.135020,3.092465261656041,,none,0.09287995906985039,,5.0,median,density_anomaly,tomek,standard,,,none,0.5888036644150813,0.6751806524013574,0.02046901684746936,COMPLETE
56,0.6026611618773613,2026-07-21 21:43:47.572806,2026-07-21 21:43:54.566699,0 days 00:00:06.993893,1.5482609395515086,,none,0.02901710373328042,5.0,5.0,median,density_clusters,tomek,standard,,,none,0.5814723003604956,0.6589386281837071,0.020510368300977026,COMPLETE
57,0.6144872483239121,2026-07-21 21:43:54.569622,2026-07-21 21:44:01.130320,0 days 00:00:06.560698,1.6226108724913926,,none,0.10024035165081117,,5.0,median,density_anomaly,tomek,standard,,,p01,0.5919298515449564,0.6741487264562336,0.021082656944273376,COMPLETE
58,0.5745172980665039,2026-07-21 21:44:01.133636,2026-07-21 21:44:08.968538,0 days 00:00:07.834902,1.9886607385220376,5.0,none,0.06652675994906725,,15.0,median,density_anomaly,allknn,standard,,,none,0.5477146703161982,0.6466885094435549,0.02889523987901308,COMPLETE
59,0.6094364746545099,2026-07-21 21:44:08.971576,2026-07-21 21:44:11.742100,0 days 00:00:02.770524,1.6872471823378297,,none,0.046814608072167495,,,median,none,tomek,standard,,,p01,0.588049558170398,0.6661867712788724,0.020542474484302735,COMPLETE
