number,value,params_C,params_balance_strategy,params_gamma,params_imputer,params_knn_neighbors,params_knn_weights,params_positive_class_weight,params_sampling_strategy,params_scaler,params_smote_k_neighbors,user_attrs_mean_average_precision,user_attrs_mean_f1_default,user_attrs_mean_roc_auc,user_attrs_std_average_precision,state
0,0.5605065786629673,0.05415244119402541,borderline_smote,0.008179499475211672,median_indicator,,,,0.7243186887373967,standard,3.0,0.5629727776488909,0.0,0.6385110540077716,0.024661989859235893,COMPLETE
1,0.4371858945194543,17.12337597316399,smote,0.008200518402245833,knn_indicator,3.0,distance,,0.9821099380386666,robust,9.0,0.4397186185183643,0.4150836838826188,0.5220397348025723,0.02532723998910008,COMPLETE
2,0.5095690785956738,75.56810141274431,class_weight_balanced,0.2115429079726121,median_indicator,,,,,power,,0.511904765185132,0.504207519739017,0.621536811930216,0.02335686589458109,COMPLETE
3,0.537927350768111,16.172900811143155,smote,0.0016736010167825778,median,,,,0.839943629105387,robust,3.0,0.5410074128969964,0.0,0.6127743578005979,0.030800621288853205,COMPLETE
4,0.56042559232637,0.17535949529764422,borderline_smote,0.009452571391072306,median,,,,0.7658143086984273,standard,3.0,0.5629265145819362,0.0,0.6384568873926396,0.02500922255566155,COMPLETE
5,0.5480266063489305,42.68407710065497,smote_tomek,0.005595986878006083,knn,3.0,distance,,0.7600245933767144,robust,7.0,0.5507958497656132,0.008723839201245536,0.6282740966612771,0.02769243416682704,COMPLETE
6,0.5700160243737484,38.40300419098858,smote_tomek,0.008995191735587165,median_indicator,,,,0.8387697846704778,power,9.0,0.5724541820349627,0.4384168872975084,0.6544505651412833,0.02438157661214273,COMPLETE
7,0.4776967543091669,77.11312991331113,class_weight_balanced,0.7715105777813047,knn_indicator,15.0,distance,,,standard,,0.4804378603252081,0.2938450189747696,0.6123886183874689,0.02741106016041166,COMPLETE
8,0.5603651909749162,0.09294394155644994,class_weight_custom,0.10385003379927414,median_indicator,,,2.9551452922306627,,robust,,0.562402635527133,0.5612294427109242,0.654816732340348,0.020374445522168178,COMPLETE
9,0.41775218360095673,5.131654955148327,class_weight_balanced,0.0011214075785991131,median,,,,,robust,,0.41991470347266546,0.3238906932430972,0.4896025203270772,0.02162519871708742,COMPLETE
10,0.560804255648202,10.584627600919594,borderline_smote,0.005442271907786736,median_indicator,,,,0.8417757837552156,power,9.0,0.5629045683307181,0.268207303044015,0.6388915755536866,0.021003126825160683,COMPLETE
11,0.5559376976678582,31.09967890667109,borderline_smote,0.0022084311239302717,median_indicator,,,,0.8329219818319151,power,9.0,0.5580559571529541,0.18883062838373044,0.6327443208053922,0.021182594850959743,COMPLETE
12,0.5616944213326178,3.9820867907305493,smote_tomek,0.0363172255195015,median_indicator,,,,0.8946186495094569,power,7.0,0.5642215213151565,0.47775390311013705,0.6470992305525696,0.025270999825386428,COMPLETE
13,0.5409238336467133,1.022579566577713,smote_tomek,0.02671520363137398,median_indicator,,,,0.9525872257593395,power,5.0,0.5436009206206329,0.46264585949917425,0.6218925031042504,0.02677086973919673,COMPLETE
14,0.5426366975393416,22.020335525868404,smote_tomek,0.10096096397428315,median_indicator,,,,0.6950484895687715,standard,9.0,0.5448416319505818,0.48856354989817163,0.64198733699172,0.022049344112401937,COMPLETE
15,0.5105413686791829,0.33785531456516676,smote_tomek,0.003859760355369963,knn,9.0,uniform,,0.899040148107568,power,7.0,0.5143807625568135,0.0,0.5804922724499234,0.03839393877630634,COMPLETE
16,0.553798813762851,72.14636784148742,class_weight_custom,0.02413638042427387,knn_indicator,9.0,distance,1.0621836732210197,,power,,0.5561589045769872,0.4396170059179312,0.6451569756993324,0.02360090814136262,COMPLETE
17,0.5432266268860361,91.913016735413,smote_tomek,0.030542030474229518,median_indicator,,,,0.8535485963474764,power,7.0,0.5463371056391699,0.4933704771639129,0.6347763161815304,0.031104787531338333,COMPLETE
18,0.5111872384637515,91.06353447447947,smote_tomek,0.0012628522257239342,knn_indicator,15.0,uniform,,0.9813817242447472,power,7.0,0.5130264064767242,0.44801953153730817,0.5912530910153457,0.018391680129727195,COMPLETE
19,0.5458114562497941,2.567080235143819,borderline_smote,0.0721270769552486,knn_indicator,3.0,uniform,,0.9822567315676288,power,3.0,0.5492363591614561,0.5359526050902763,0.6452784498734313,0.03424902911661941,COMPLETE
20,0.5768228901267394,7.824520430340897,smote_tomek,0.05564284242478379,median,,,,0.8234281858502869,power,5.0,0.5792785279939329,0.4859238831750619,0.6696161774356888,0.024556378671935445,COMPLETE
21,0.572915302786887,7.403353644545318,smote,0.032140608915529535,median,,,,0.86611360518945,power,5.0,0.5758176117995559,0.4713092710151242,0.6652059375651208,0.02902309012668947,COMPLETE
22,0.5005995221224487,9.192338330805928,smote,0.31932156559160096,median,,,,0.8306796249621345,power,5.0,0.5035157674441207,0.4812102308147286,0.6220073540421406,0.029162453216720438,COMPLETE
23,0.583501659056273,12.8774043048462,none,0.01223484917613848,median,,,,,power,,0.5855145691454948,0.29334887902979556,0.6675028489203617,0.020129100892218012,COMPLETE
24,0.5666602170081895,1.406735574656476,none,0.0032488758063904375,median,,,,,power,,0.5691906079901335,0.0,0.645192131357857,0.02530390981944125,COMPLETE
25,0.5731080214793853,48.123520539908775,none,0.03499545757407334,median,,,,,power,,0.5756233928261763,0.42367254903325147,0.669538109006505,0.0251537134679091,COMPLETE
26,0.5563204529231184,76.2981253861559,none,0.07329208946830144,median,,,,,power,,0.5596112524131509,0.4847499273117988,0.6577797165677954,0.032907994900325706,COMPLETE
27,0.5765723876939172,17.679690240953096,smote_tomek,0.12606707169531156,median,,,,0.755961258507407,robust,5.0,0.5788670890024645,0.3855716296157551,0.6675265667328557,0.022947013085473675,COMPLETE
28,0.5711767370735431,23.409430740807323,none,0.004561502023232514,knn_indicator,11.0,uniform,,,standard,,0.5731422677387864,0.21670564270094186,0.652809958998222,0.019655306652432855,COMPLETE
29,0.5751699339817863,11.024444989404067,smote_tomek,0.32519099658333933,median,,,,0.6523306116916745,robust,5.0,0.5777354929228284,0.41020597291080374,0.66817268498165,0.02565558941042207,COMPLETE
30,0.5348657900922607,1.2241862667561871,class_weight_custom,0.062377296013577235,median,,,1.7578244063590305,,robust,,0.5371939726287499,0.5683480420689845,0.6149196827930269,0.02328182536489274,COMPLETE
31,0.5811475237453732,11.649064973474626,smote_tomek,0.11424663715684988,median,,,,0.6545715940669304,robust,5.0,0.5832298453232061,0.32459528254596215,0.6677090631320002,0.02082321577832937,COMPLETE
32,0.5610824367552609,40.003424855233256,class_weight_balanced,0.029186708038808542,median,,,,,robust,,0.5636199525353038,0.43384247607345233,0.643731220831478,0.025375157800428653,COMPLETE
33,0.5782437636568659,14.388522771311367,smote_tomek,0.01693748863689391,median,,,,0.7134353713398014,standard,5.0,0.5803339270374087,0.35244012126100316,0.666808007269924,0.020901633805428154,COMPLETE
34,0.564985262552175,2.5420418117057264,smote_tomek,0.007943492659198803,median,,,,0.716777814048936,standard,5.0,0.5673501198109561,0.12957563382953446,0.6462112259174638,0.023648572587810716,COMPLETE
35,0.5807424003231147,2.1166230163330835,none,0.18457724534944903,median,,,,,standard,,0.5839058240364849,0.4670655191433065,0.6718001026988707,0.031634237133702045,COMPLETE
36,0.5752084629634626,22.14962732854849,none,0.04344125941172601,median,,,,,standard,,0.5777429830242056,0.4204885901320855,0.6712048896346711,0.02534520060742958,COMPLETE
37,0.5762557842311868,0.8125671202592114,none,0.27038922398488446,median,,,,,standard,,0.5789246511366504,0.38758146009555955,0.6654003547119015,0.026688669054635596,COMPLETE
38,0.5556061571376372,1.3589823395616718,class_weight_balanced,0.025662985113996034,knn,7.0,uniform,,,standard,,0.5580299163291051,0.4378339578999613,0.6382936200346987,0.02423759191467926,COMPLETE
39,0.5728081516133279,8.00362612219995,none,0.39852159554222927,median_indicator,,,,,robust,,0.5755030173185334,0.44998921774291,0.663395271232585,0.026948657052054775,COMPLETE
40,0.5085577085689917,6.3646386948308376,borderline_smote,0.31015253554650446,median,,,,0.6671761428550318,standard,7.0,0.5116256329723051,0.48432744106349357,0.6280842201716492,0.03067924403313389,COMPLETE
41,0.5721928784981589,9.643841905501485,smote_tomek,0.04576441855941953,median,,,,0.6760172862952285,power,5.0,0.5746274888623386,0.4047566821958963,0.6667894848368662,0.024346103641796502,COMPLETE
42,0.5708545341281995,66.6616548882541,smote,0.021904252768911493,median,,,,0.7258932759146984,standard,5.0,0.5729808935247898,0.43229843758124237,0.6677342086841427,0.021263593965902088,COMPLETE
43,0.5721401688070956,37.977244267638774,none,0.0024081355760848153,knn,11.0,distance,,,power,,0.5744605279194088,0.15574255712654742,0.6541551823224704,0.02320359112313216,COMPLETE
44,0.5584056027711009,4.382625931532133,none,0.14543115603917664,knn_indicator,7.0,distance,,,standard,,0.5609986507923673,0.49012663814053675,0.6556444678567199,0.025930480212665235,COMPLETE
45,0.5721291597587841,22.17732119758488,smote_tomek,0.06566941353897299,median,,,,0.6571557942650516,standard,5.0,0.5743080190707299,0.45111484195460144,0.6650599300452078,0.02178859311945845,COMPLETE
46,0.5835530970734563,2.816547741480755,none,0.02645548500858445,knn,13.0,uniform,,,power,,0.5858291350911384,0.2876055640899581,0.6677218919407927,0.022760380176821193,COMPLETE
47,0.5761085481146585,5.616638807081523,none,0.07330872318667278,knn,13.0,uniform,,,power,,0.5784178469412837,0.421446176392602,0.6704848352030047,0.0230929882662521,COMPLETE
48,0.5691402484365092,0.9038176486995528,smote,0.26041545126451815,knn,15.0,uniform,,0.656469121209557,standard,3.0,0.57191100674886,0.41747328105976733,0.664922524920206,0.027707583123507882,COMPLETE
49,0.5438602673815853,19.33997990447968,class_weight_custom,0.0030372107688831527,median,,,1.8120943377506429,,power,,0.5458682298797858,0.5741713299717184,0.6251917544533295,0.020079624982004954,COMPLETE
